[I 2025-04-30 14:08:32,714] Trial 240 finished with value: 0.8919318181818182 and parameters: {'n_estimators': 519, 'max_depth': 49, 'min_samples_split': 6, 'min_samples_leaf': 1, 'max_features': 'sqrt', 'bootstrap': True}. Best is trial 183 with value: 0.892159090909091.
[I 2025-04-30 14:08:44,500] Trial 241 finished with value: 0.892159090909091 and parameters: {'n_estimators': 522, 'max_depth': 49, 'min_samples_split': 6, 'min_samples_leaf': 1, 'max_features': 'sqrt', 'bootstrap': True}. Best is trial 183 with value: 0.892159090909091.
[I 2025-04-30 14:08:56,146] Trial 242 finished with value: 0.8919318181818182 and parameters: {'n_estimators': 519, 'max_depth': 50, 'min_samples_split': 6, 'min_samples_leaf': 1, 'max_features': 'sqrt', 'bootstrap': True}. Best is trial 183 with value: 0.892159090909091.
[I 2025-04-30 14:09:07,234] Trial 243 finished with value: 0.89125 and parameters: {'n_estimators': 491, 'max_depth': 50, 'min_samples_split': 6, 'min_samples_leaf': 1, 'max_features': 'sqrt', 'bootstrap': True}. Best is trial 183 with value: 0.892159090909091.
[I 2025-04-30 14:09:18,835] Trial 244 finished with value: 0.8917045454545454 and parameters: {'n_estimators': 517, 'max_depth': 50, 'min_samples_split': 6, 'min_samples_leaf': 1, 'max_features': 'sqrt', 'bootstrap': True}. Best is trial 183 with value: 0.892159090909091.
[I 2025-04-30 14:09:31,519] Trial 245 finished with value: 0.8917045454545454 and parameters: {'n_estimators': 549, 'max_depth': 49, 'min_samples_split': 6, 'min_samples_leaf': 1, 'max_features': 'sqrt', 'bootstrap': True}. Best is trial 183 with value: 0.892159090909091.
[I 2025-04-30 14:09:43,007] Trial 246 finished with value: 0.89125 and parameters: {'n_estimators': 507, 'max_depth': 49, 'min_samples_split': 6, 'min_samples_leaf': 1, 'max_features': 'sqrt', 'bootstrap': True}. Best is trial 183 with value: 0.892159090909091.
[I 2025-04-30 14:09:53,612] Trial 247 finished with value: 0.8905681818181819 and parameters: {'n_estimators': 463, 'max_depth': 50, 'min_samples_split': 6, 'min_samples_leaf': 1, 'max_features': 'sqrt', 'bootstrap': True}. Best is trial 183 with value: 0.892159090909091.
[I 2025-04-30 14:10:09,662] Trial 248 finished with value: 0.889090909090909 and parameters: {'n_estimators': 538, 'max_depth': 47, 'min_samples_split': 6, 'min_samples_leaf': 1, 'max_features': 'sqrt', 'bootstrap': False}. Best is trial 183 with value: 0.892159090909091.
[I 2025-04-30 14:10:18,949] Trial 249 finished with value: 0.8851136363636363 and parameters: {'n_estimators': 490, 'max_depth': 48, 'min_samples_split': 6, 'min_samples_leaf': 9, 'max_features': 'sqrt', 'bootstrap': True}. Best is trial 183 with value: 0.892159090909091.

Best hyperparameters found by Optuna:
{'n_estimators': 522, 'max_depth': 48, 'min_samples_split': 6, 'min_samples_leaf': 1, 'max_features': 'sqrt', 'bootstrap': True}