[I 2025-04-30 13:08:40,843] A new study created in memory with name: no-name-7fde4f54-d88f-4a98-b727-4c149e450f80
[I 2025-04-30 13:08:59,284] Trial 0 finished with value: 0.8684090909090909 and parameters: {'n_estimators': 912, 'max_depth': 5, 'min_samples_split': 10, 'min_samples_leaf': 7, 'max_features': 'sqrt', 'bootstrap': True}. Best is trial 0 with value: 0.8684090909090909.
[I 2025-04-30 13:10:30,512] Trial 1 finished with value: 0.8482954545454546 and parameters: {'n_estimators': 951, 'max_depth': 43, 'min_samples_split': 6, 'min_samples_leaf': 4, 'max_features': None, 'bootstrap': False}. Best is trial 0 with value: 0.8684090909090909.
[I 2025-04-30 13:10:44,602] Trial 2 finished with value: 0.8846590909090908 and parameters: {'n_estimators': 724, 'max_depth': 21, 'min_samples_split': 7, 'min_samples_leaf': 10, 'max_features': 'sqrt', 'bootstrap': True}. Best is trial 2 with value: 0.8846590909090908.
[I 2025-04-30 13:10:57,507] Trial 3 finished with value: 0.8911363636363635 and parameters: {'n_estimators': 551, 'max_depth': 48, 'min_samples_split': 6, 'min_samples_leaf': 1, 'max_features': 'sqrt', 'bootstrap': True}. Best is trial 3 with value: 0.8911363636363635.
[I 2025-04-30 13:11:10,101] Trial 4 finished with value: 0.8862500000000001 and parameters: {'n_estimators': 641, 'max_depth': 35, 'min_samples_split': 4, 'min_samples_leaf': 8, 'max_features': 'log2', 'bootstrap': True}. Best is trial 3 with value: 0.8911363636363635.
[I 2025-04-30 13:11:22,541] Trial 5 finished with value: 0.8494318181818181 and parameters: {'n_estimators': 132, 'max_depth': 29, 'min_samples_split': 5, 'min_samples_leaf': 5, 'max_features': None, 'bootstrap': False}. Best is trial 3 with value: 0.8911363636363635.
[I 2025-04-30 13:11:41,632] Trial 6 finished with value: 0.8871590909090908 and parameters: {'n_estimators': 299, 'max_depth': 14, 'min_samples_split': 6, 'min_samples_leaf': 5, 'max_features': None, 'bootstrap': True}. Best is trial 3 with value: 0.8911363636363635.
[I 2025-04-30 13:11:52,170] Trial 7 finished with value: 0.8872727272727271 and parameters: {'n_estimators': 531, 'max_depth': 18, 'min_samples_split': 3, 'min_samples_leaf': 6, 'max_features': 'sqrt', 'bootstrap': True}. Best is trial 3 with value: 0.8911363636363635.
[I 2025-04-30 13:12:08,155] Trial 8 finished with value: 0.8906818181818181 and parameters: {'n_estimators': 725, 'max_depth': 42, 'min_samples_split': 10, 'min_samples_leaf': 1, 'max_features': 'log2', 'bootstrap': True}. Best is trial 3 with value: 0.8911363636363635.
[I 2025-04-30 13:12:28,182] Trial 9 finished with value: 0.8551136363636364 and parameters: {'n_estimators': 214, 'max_depth': 17, 'min_samples_split': 8, 'min_samples_leaf': 6, 'max_features': None, 'bootstrap': False}. Best is trial 3 with value: 0.8911363636363635.
[I 2025-04-30 13:12:42,314] Trial 10 finished with value: 0.886590909090909 and parameters: {'n_estimators': 441, 'max_depth': 48, 'min_samples_split': 2, 'min_samples_leaf': 1, 'max_features': 'sqrt', 'bootstrap': False}. Best is trial 3 with value: 0.8911363636363635.
[I 2025-04-30 13:12:59,061] Trial 11 finished with value: 0.8902272727272728 and parameters: {'n_estimators': 763, 'max_depth': 40, 'min_samples_split': 10, 'min_samples_leaf': 1, 'max_features': 'log2', 'bootstrap': True}. Best is trial 3 with value: 0.8911363636363635.
[I 2025-04-30 13:13:08,385] Trial 12 finished with value: 0.8880681818181818 and parameters: {'n_estimators': 436, 'max_depth': 50, 'min_samples_split': 8, 'min_samples_leaf': 3, 'max_features': 'log2', 'bootstrap': True}. Best is trial 3 with value: 0.8911363636363635.
[I 2025-04-30 13:13:27,093] Trial 13 finished with value: 0.8888636363636362 and parameters: {'n_estimators': 817, 'max_depth': 35, 'min_samples_split': 8, 'min_samples_leaf': 2, 'max_features': 'log2', 'bootstrap': True}. Best is trial 3 with value: 0.8911363636363635.
[I 2025-04-30 13:13:39,768] Trial 14 finished with value: 0.8898863636363636 and parameters: {'n_estimators': 607, 'max_depth': 43, 'min_samples_split': 9, 'min_samples_leaf': 3, 'max_features': 'sqrt', 'bootstrap': True}. Best is trial 3 with value: 0.8911363636363635.
[I 2025-04-30 13:13:57,628] Trial 15 finished with value: 0.8898863636363636 and parameters: {'n_estimators': 486, 'max_depth': 34, 'min_samples_split': 5, 'min_samples_leaf': 1, 'max_features': 'log2', 'bootstrap': True}. Best is trial 3 with value: 0.8911363636363635.
[I 2025-04-30 13:14:04,715] Trial 16 finished with value: 0.890340909090909 and parameters: {'n_estimators': 326, 'max_depth': 46, 'min_samples_split': 7, 'min_samples_leaf': 3, 'max_features': 'sqrt', 'bootstrap': True}. Best is trial 3 with value: 0.8911363636363635.
[I 2025-04-30 13:14:20,146] Trial 17 finished with value: 0.8905681818181819 and parameters: {'n_estimators': 677, 'max_depth': 39, 'min_samples_split': 4, 'min_samples_leaf': 2, 'max_features': 'log2', 'bootstrap': True}. Best is trial 3 with value: 0.8911363636363635.
[I 2025-04-30 13:14:46,355] Trial 18 finished with value: 0.8893181818181818 and parameters: {'n_estimators': 874, 'max_depth': 27, 'min_samples_split': 9, 'min_samples_leaf': 2, 'max_features': 'log2', 'bootstrap': False}. Best is trial 3 with value: 0.8911363636363635.
[I 2025-04-30 13:14:58,255] Trial 19 finished with value: 0.8844318181818182 and parameters: {'n_estimators': 585, 'max_depth': 27, 'min_samples_split': 5, 'min_samples_leaf': 10, 'max_features': 'sqrt', 'bootstrap': True}. Best is trial 3 with value: 0.8911363636363635.
[I 2025-04-30 13:15:30,030] Trial 20 finished with value: 0.8873863636363637 and parameters: {'n_estimators': 992, 'max_depth': 50, 'min_samples_split': 7, 'min_samples_leaf': 4, 'max_features': 'log2', 'bootstrap': True}. Best is trial 3 with value: 0.8911363636363635.
[I 2025-04-30 13:15:46,388] Trial 21 finished with value: 0.8905681818181819 and parameters: {'n_estimators': 692, 'max_depth': 39, 'min_samples_split': 4, 'min_samples_leaf': 2, 'max_features': 'log2', 'bootstrap': True}. Best is trial 3 with value: 0.8911363636363635.
[I 2025-04-30 13:16:15,705] Trial 22 finished with value: 0.8896590909090909 and parameters: {'n_estimators': 663, 'max_depth': 44, 'min_samples_split': 2, 'min_samples_leaf': 1, 'max_features': 'log2', 'bootstrap': True}. Best is trial 3 with value: 0.8911363636363635.
[I 2025-04-30 13:16:42,753] Trial 23 finished with value: 0.8893181818181818 and parameters: {'n_estimators': 782, 'max_depth': 40, 'min_samples_split': 4, 'min_samples_leaf': 2, 'max_features': 'log2', 'bootstrap': True}. Best is trial 3 with value: 0.8911363636363635.
[I 2025-04-30 13:17:02,720] Trial 24 finished with value: 0.8898863636363636 and parameters: {'n_estimators': 842, 'max_depth': 38, 'min_samples_split': 3, 'min_samples_leaf': 1, 'max_features': 'log2', 'bootstrap': True}. Best is trial 3 with value: 0.8911363636363635.
[I 2025-04-30 13:17:13,895] Trial 25 finished with value: 0.8878409090909092 and parameters: {'n_estimators': 548, 'max_depth': 32, 'min_samples_split': 6, 'min_samples_leaf': 4, 'max_features': 'sqrt', 'bootstrap': True}. Best is trial 3 with value: 0.8911363636363635.
[I 2025-04-30 13:17:24,780] Trial 26 finished with value: 0.8889772727272727 and parameters: {'n_estimators': 387, 'max_depth': 46, 'min_samples_split': 3, 'min_samples_leaf': 3, 'max_features': 'log2', 'bootstrap': False}. Best is trial 3 with value: 0.8911363636363635.
[I 2025-04-30 13:17:40,667] Trial 27 finished with value: 0.889090909090909 and parameters: {'n_estimators': 735, 'max_depth': 45, 'min_samples_split': 5, 'min_samples_leaf': 2, 'max_features': 'log2', 'bootstrap': True}. Best is trial 3 with value: 0.8911363636363635.
[I 2025-04-30 13:18:28,108] Trial 28 finished with value: 0.8867045454545455 and parameters: {'n_estimators': 643, 'max_depth': 42, 'min_samples_split': 9, 'min_samples_leaf': 1, 'max_features': None, 'bootstrap': True}. Best is trial 3 with value: 0.8911363636363635.
[I 2025-04-30 13:18:45,307] Trial 29 finished with value: 0.8864772727272726 and parameters: {'n_estimators': 897, 'max_depth': 30, 'min_samples_split': 10, 'min_samples_leaf': 8, 'max_features': 'sqrt', 'bootstrap': True}. Best is trial 3 with value: 0.8911363636363635.
[I 2025-04-30 13:18:56,417] Trial 30 finished with value: 0.8885227272727272 and parameters: {'n_estimators': 520, 'max_depth': 38, 'min_samples_split': 7, 'min_samples_leaf': 2, 'max_features': 'sqrt', 'bootstrap': True}. Best is trial 3 with value: 0.8911363636363635.
[I 2025-04-30 13:19:12,235] Trial 31 finished with value: 0.8902272727272728 and parameters: {'n_estimators': 691, 'max_depth': 39, 'min_samples_split': 4, 'min_samples_leaf': 2, 'max_features': 'log2', 'bootstrap': True}. Best is trial 3 with value: 0.8911363636363635.
[I 2025-04-30 13:19:24,116] Trial 32 finished with value: 0.8871590909090908 and parameters: {'n_estimators': 595, 'max_depth': 10, 'min_samples_split': 4, 'min_samples_leaf': 3, 'max_features': 'log2', 'bootstrap': True}. Best is trial 3 with value: 0.8911363636363635.
[I 2025-04-30 13:19:39,321] Trial 33 finished with value: 0.8896590909090909 and parameters: {'n_estimators': 682, 'max_depth': 23, 'min_samples_split': 6, 'min_samples_leaf': 2, 'max_features': 'log2', 'bootstrap': True}. Best is trial 3 with value: 0.8911363636363635.
[I 2025-04-30 13:19:56,519] Trial 34 finished with value: 0.89 and parameters: {'n_estimators': 709, 'max_depth': 36, 'min_samples_split': 3, 'min_samples_leaf': 1, 'max_features': 'log2', 'bootstrap': True}. Best is trial 3 with value: 0.8911363636363635.
[I 2025-04-30 13:20:18,451] Trial 35 finished with value: 0.8902272727272728 and parameters: {'n_estimators': 797, 'max_depth': 47, 'min_samples_split': 6, 'min_samples_leaf': 4, 'max_features': 'log2', 'bootstrap': False}. Best is trial 3 with value: 0.8911363636363635.
[I 2025-04-30 13:20:54,657] Trial 36 finished with value: 0.8844318181818182 and parameters: {'n_estimators': 613, 'max_depth': 33, 'min_samples_split': 5, 'min_samples_leaf': 8, 'max_features': None, 'bootstrap': True}. Best is trial 3 with value: 0.8911363636363635.
[I 2025-04-30 13:21:15,219] Trial 37 finished with value: 0.8878409090909092 and parameters: {'n_estimators': 942, 'max_depth': 41, 'min_samples_split': 4, 'min_samples_leaf': 5, 'max_features': 'sqrt', 'bootstrap': True}. Best is trial 3 with value: 0.8911363636363635.
[I 2025-04-30 13:22:29,601] Trial 38 finished with value: 0.8487500000000001 and parameters: {'n_estimators': 756, 'max_depth': 43, 'min_samples_split': 3, 'min_samples_leaf': 3, 'max_features': None, 'bootstrap': False}. Best is trial 3 with value: 0.8911363636363635.
[I 2025-04-30 13:22:36,244] Trial 39 finished with value: 0.8681818181818182 and parameters: {'n_estimators': 479, 'max_depth': 5, 'min_samples_split': 5, 'min_samples_leaf': 4, 'max_features': 'log2', 'bootstrap': True}. Best is trial 3 with value: 0.8911363636363635.
[I 2025-04-30 13:22:49,786] Trial 40 finished with value: 0.8894318181818182 and parameters: {'n_estimators': 560, 'max_depth': 48, 'min_samples_split': 2, 'min_samples_leaf': 1, 'max_features': 'sqrt', 'bootstrap': True}. Best is trial 3 with value: 0.8911363636363635.
[I 2025-04-30 13:22:56,457] Trial 41 finished with value: 0.8889772727272728 and parameters: {'n_estimators': 303, 'max_depth': 45, 'min_samples_split': 7, 'min_samples_leaf': 2, 'max_features': 'sqrt', 'bootstrap': True}. Best is trial 3 with value: 0.8911363636363635.
[I 2025-04-30 13:22:59,327] Trial 42 finished with value: 0.8876136363636362 and parameters: {'n_estimators': 135, 'max_depth': 37, 'min_samples_split': 6, 'min_samples_leaf': 3, 'max_features': 'sqrt', 'bootstrap': True}. Best is trial 3 with value: 0.8911363636363635.
[I 2025-04-30 13:23:07,849] Trial 43 finished with value: 0.8902272727272728 and parameters: {'n_estimators': 377, 'max_depth': 48, 'min_samples_split': 7, 'min_samples_leaf': 1, 'max_features': 'sqrt', 'bootstrap': True}. Best is trial 3 with value: 0.8911363636363635.
[I 2025-04-30 13:23:13,043] Trial 44 finished with value: 0.8847727272727273 and parameters: {'n_estimators': 263, 'max_depth': 50, 'min_samples_split': 8, 'min_samples_leaf': 7, 'max_features': 'sqrt', 'bootstrap': True}. Best is trial 3 with value: 0.8911363636363635.
[I 2025-04-30 13:23:27,639] Trial 45 finished with value: 0.8898863636363636 and parameters: {'n_estimators': 634, 'max_depth': 42, 'min_samples_split': 6, 'min_samples_leaf': 2, 'max_features': 'sqrt', 'bootstrap': True}. Best is trial 3 with value: 0.8911363636363635.
[I 2025-04-30 13:23:50,099] Trial 46 finished with value: 0.8896590909090909 and parameters: {'n_estimators': 726, 'max_depth': 46, 'min_samples_split': 9, 'min_samples_leaf': 3, 'max_features': 'log2', 'bootstrap': False}. Best is trial 3 with value: 0.8911363636363635.
[I 2025-04-30 13:24:16,224] Trial 47 finished with value: 0.8870454545454545 and parameters: {'n_estimators': 374, 'max_depth': 41, 'min_samples_split': 10, 'min_samples_leaf': 1, 'max_features': None, 'bootstrap': True}. Best is trial 3 with value: 0.8911363636363635.
[I 2025-04-30 13:24:25,841] Trial 48 finished with value: 0.8902272727272728 and parameters: {'n_estimators': 418, 'max_depth': 44, 'min_samples_split': 4, 'min_samples_leaf': 2, 'max_features': 'log2', 'bootstrap': True}. Best is trial 3 with value: 0.8911363636363635.
[I 2025-04-30 13:24:35,674] Trial 49 finished with value: 0.8872727272727273 and parameters: {'n_estimators': 482, 'max_depth': 25, 'min_samples_split': 5, 'min_samples_leaf': 5, 'max_features': 'sqrt', 'bootstrap': True}. Best is trial 3 with value: 0.8911363636363635.
[I 2025-04-30 13:24:53,246] Trial 50 finished with value: 0.8893181818181819 and parameters: {'n_estimators': 839, 'max_depth': 31, 'min_samples_split': 7, 'min_samples_leaf': 3, 'max_features': 'log2', 'bootstrap': True}. Best is trial 3 with value: 0.8911363636363635.
[I 2025-04-30 13:25:09,910] Trial 51 finished with value: 0.8901136363636365 and parameters: {'n_estimators': 765, 'max_depth': 40, 'min_samples_split': 10, 'min_samples_leaf': 1, 'max_features': 'log2', 'bootstrap': True}. Best is trial 3 with value: 0.8911363636363635.
[I 2025-04-30 13:25:24,852] Trial 52 finished with value: 0.89 and parameters: {'n_estimators': 674, 'max_depth': 34, 'min_samples_split': 8, 'min_samples_leaf': 1, 'max_features': 'log2', 'bootstrap': True}. Best is trial 3 with value: 0.8911363636363635.
[I 2025-04-30 13:25:40,654] Trial 53 finished with value: 0.8847727272727273 and parameters: {'n_estimators': 810, 'max_depth': 37, 'min_samples_split': 10, 'min_samples_leaf': 9, 'max_features': 'log2', 'bootstrap': True}. Best is trial 3 with value: 0.8911363636363635.
[I 2025-04-30 13:25:56,901] Trial 54 finished with value: 0.8882954545454546 and parameters: {'n_estimators': 753, 'max_depth': 48, 'min_samples_split': 9, 'min_samples_leaf': 2, 'max_features': 'log2', 'bootstrap': True}. Best is trial 3 with value: 0.8911363636363635.
[I 2025-04-30 13:26:10,937] Trial 55 finished with value: 0.890909090909091 and parameters: {'n_estimators': 645, 'max_depth': 39, 'min_samples_split': 9, 'min_samples_leaf': 1, 'max_features': 'log2', 'bootstrap': True}. Best is trial 3 with value: 0.8911363636363635.
[I 2025-04-30 13:26:26,159] Trial 56 finished with value: 0.8893181818181819 and parameters: {'n_estimators': 515, 'max_depth': 42, 'min_samples_split': 9, 'min_samples_leaf': 1, 'max_features': 'log2', 'bootstrap': False}. Best is trial 3 with value: 0.8911363636363635.
[I 2025-04-30 13:26:39,898] Trial 57 finished with value: 0.8887499999999999 and parameters: {'n_estimators': 639, 'max_depth': 44, 'min_samples_split': 9, 'min_samples_leaf': 2, 'max_features': 'sqrt', 'bootstrap': True}. Best is trial 3 with value: 0.8911363636363635.
[I 2025-04-30 13:26:52,268] Trial 58 finished with value: 0.8903409090909091 and parameters: {'n_estimators': 570, 'max_depth': 35, 'min_samples_split': 8, 'min_samples_leaf': 1, 'max_features': 'log2', 'bootstrap': True}. Best is trial 3 with value: 0.8911363636363635.
[I 2025-04-30 13:27:05,157] Trial 59 finished with value: 0.8904545454545454 and parameters: {'n_estimators': 586, 'max_depth': 36, 'min_samples_split': 8, 'min_samples_leaf': 1, 'max_features': 'log2', 'bootstrap': True}. Best is trial 3 with value: 0.8911363636363635.
[I 2025-04-30 13:27:21,129] Trial 60 finished with value: 0.8906818181818181 and parameters: {'n_estimators': 709, 'max_depth': 39, 'min_samples_split': 10, 'min_samples_leaf': 1, 'max_features': 'log2', 'bootstrap': True}. Best is trial 3 with value: 0.8911363636363635.
[I 2025-04-30 13:27:36,606] Trial 61 finished with value: 0.8902272727272728 and parameters: {'n_estimators': 708, 'max_depth': 38, 'min_samples_split': 10, 'min_samples_leaf': 1, 'max_features': 'log2', 'bootstrap': True}. Best is trial 3 with value: 0.8911363636363635.
[I 2025-04-30 13:27:51,724] Trial 62 finished with value: 0.8901136363636365 and parameters: {'n_estimators': 614, 'max_depth': 40, 'min_samples_split': 10, 'min_samples_leaf': 1, 'max_features': 'log2', 'bootstrap': True}. Best is trial 3 with value: 0.8911363636363635.
[I 2025-04-30 13:28:05,759] Trial 63 finished with value: 0.8892045454545453 and parameters: {'n_estimators': 655, 'max_depth': 36, 'min_samples_split': 9, 'min_samples_leaf': 2, 'max_features': 'log2', 'bootstrap': True}. Best is trial 3 with value: 0.8911363636363635.
[I 2025-04-30 13:28:21,099] Trial 64 finished with value: 0.8910227272727272 and parameters: {'n_estimators': 683, 'max_depth': 39, 'min_samples_split': 9, 'min_samples_leaf': 1, 'max_features': 'log2', 'bootstrap': True}. Best is trial 3 with value: 0.8911363636363635.
[I 2025-04-30 13:28:36,305] Trial 65 finished with value: 0.8885227272727272 and parameters: {'n_estimators': 692, 'max_depth': 39, 'min_samples_split': 10, 'min_samples_leaf': 2, 'max_features': 'log2', 'bootstrap': True}. Best is trial 3 with value: 0.8911363636363635.
[I 2025-04-30 13:28:52,714] Trial 66 finished with value: 0.8907954545454544 and parameters: {'n_estimators': 736, 'max_depth': 29, 'min_samples_split': 9, 'min_samples_leaf': 1, 'max_features': 'log2', 'bootstrap': True}. Best is trial 3 with value: 0.8911363636363635.
[I 2025-04-30 13:29:11,639] Trial 67 finished with value: 0.8896590909090909 and parameters: {'n_estimators': 869, 'max_depth': 20, 'min_samples_split': 9, 'min_samples_leaf': 1, 'max_features': 'log2', 'bootstrap': True}. Best is trial 3 with value: 0.8911363636363635.
[I 2025-04-30 13:29:34,686] Trial 68 finished with value: 0.8899999999999999 and parameters: {'n_estimators': 783, 'max_depth': 28, 'min_samples_split': 10, 'min_samples_leaf': 1, 'max_features': 'log2', 'bootstrap': False}. Best is trial 3 with value: 0.8911363636363635.
[I 2025-04-30 13:29:50,902] Trial 69 finished with value: 0.8897727272727274 and parameters: {'n_estimators': 742, 'max_depth': 32, 'min_samples_split': 8, 'min_samples_leaf': 1, 'max_features': 'log2', 'bootstrap': True}. Best is trial 3 with value: 0.8911363636363635.
[I 2025-04-30 13:30:39,438] Trial 70 finished with value: 0.8873863636363636 and parameters: {'n_estimators': 716, 'max_depth': 25, 'min_samples_split': 9, 'min_samples_leaf': 2, 'max_features': None, 'bootstrap': True}. Best is trial 3 with value: 0.8911363636363635.
[I 2025-04-30 13:30:52,493] Trial 71 finished with value: 0.8877272727272727 and parameters: {'n_estimators': 665, 'max_depth': 15, 'min_samples_split': 4, 'min_samples_leaf': 6, 'max_features': 'log2', 'bootstrap': True}. Best is trial 3 with value: 0.8911363636363635.
[I 2025-04-30 13:31:05,597] Trial 72 finished with value: 0.8887499999999999 and parameters: {'n_estimators': 616, 'max_depth': 39, 'min_samples_split': 9, 'min_samples_leaf': 2, 'max_features': 'log2', 'bootstrap': True}. Best is trial 3 with value: 0.8911363636363635.
[I 2025-04-30 13:31:20,548] Trial 73 finished with value: 0.8903409090909091 and parameters: {'n_estimators': 687, 'max_depth': 43, 'min_samples_split': 10, 'min_samples_leaf': 1, 'max_features': 'log2', 'bootstrap': True}. Best is trial 3 with value: 0.8911363636363635.
[I 2025-04-30 13:31:32,191] Trial 74 finished with value: 0.8897727272727274 and parameters: {'n_estimators': 535, 'max_depth': 41, 'min_samples_split': 10, 'min_samples_leaf': 1, 'max_features': 'log2', 'bootstrap': True}. Best is trial 3 with value: 0.8911363636363635.
[I 2025-04-30 13:31:48,008] Trial 75 finished with value: 0.8884090909090908 and parameters: {'n_estimators': 730, 'max_depth': 34, 'min_samples_split': 9, 'min_samples_leaf': 2, 'max_features': 'log2', 'bootstrap': True}. Best is trial 3 with value: 0.8911363636363635.
[I 2025-04-30 13:32:08,002] Trial 76 finished with value: 0.8895454545454546 and parameters: {'n_estimators': 776, 'max_depth': 38, 'min_samples_split': 2, 'min_samples_leaf': 1, 'max_features': 'log2', 'bootstrap': True}. Best is trial 3 with value: 0.8911363636363635.
[I 2025-04-30 13:32:27,189] Trial 77 finished with value: 0.8898863636363636 and parameters: {'n_estimators': 826, 'max_depth': 30, 'min_samples_split': 4, 'min_samples_leaf': 2, 'max_features': 'log2', 'bootstrap': True}. Best is trial 3 with value: 0.8911363636363635.
[I 2025-04-30 13:32:42,127] Trial 78 finished with value: 0.8901136363636365 and parameters: {'n_estimators': 640, 'max_depth': 37, 'min_samples_split': 3, 'min_samples_leaf': 1, 'max_features': 'log2', 'bootstrap': True}. Best is trial 3 with value: 0.8911363636363635.
[I 2025-04-30 13:33:51,357] Trial 79 finished with value: 0.8478409090909091 and parameters: {'n_estimators': 697, 'max_depth': 42, 'min_samples_split': 5, 'min_samples_leaf': 2, 'max_features': None, 'bootstrap': False}. Best is trial 3 with value: 0.8911363636363635.
