[I 2025-04-30 13:34:02,517] Trial 80 finished with value: 0.8848863636363635 and parameters: {'n_estimators': 576, 'max_depth': 46, 'min_samples_split': 10, 'min_samples_leaf': 7, 'max_features': 'log2', 'bootstrap': True}. Best is trial 3 with value: 0.8911363636363635.
[I 2025-04-30 13:34:15,628] Trial 81 finished with value: 0.8902272727272728 and parameters: {'n_estimators': 589, 'max_depth': 36, 'min_samples_split': 8, 'min_samples_leaf': 1, 'max_features': 'log2', 'bootstrap': True}. Best is trial 3 with value: 0.8911363636363635.
[I 2025-04-30 13:34:30,659] Trial 82 finished with value: 0.8898863636363636 and parameters: {'n_estimators': 665, 'max_depth': 39, 'min_samples_split': 8, 'min_samples_leaf': 1, 'max_features': 'log2', 'bootstrap': True}. Best is trial 3 with value: 0.8911363636363635.
[I 2025-04-30 13:34:44,799] Trial 83 finished with value: 0.8906818181818181 and parameters: {'n_estimators': 623, 'max_depth': 36, 'min_samples_split': 9, 'min_samples_leaf': 1, 'max_features': 'log2', 'bootstrap': True}. Best is trial 3 with value: 0.8911363636363635.
[I 2025-04-30 13:34:58,898] Trial 84 finished with value: 0.8906818181818181 and parameters: {'n_estimators': 627, 'max_depth': 41, 'min_samples_split': 9, 'min_samples_leaf': 1, 'max_features': 'log2', 'bootstrap': True}. Best is trial 3 with value: 0.8911363636363635.
[I 2025-04-30 13:35:13,821] Trial 85 finished with value: 0.8906818181818184 and parameters: {'n_estimators': 624, 'max_depth': 40, 'min_samples_split': 9, 'min_samples_leaf': 1, 'max_features': 'log2', 'bootstrap': True}. Best is trial 3 with value: 0.8911363636363635.
[I 2025-04-30 13:35:25,480] Trial 86 finished with value: 0.8901136363636363 and parameters: {'n_estimators': 510, 'max_depth': 41, 'min_samples_split': 9, 'min_samples_leaf': 1, 'max_features': 'log2', 'bootstrap': True}. Best is trial 3 with value: 0.8911363636363635.
[I 2025-04-30 13:35:37,873] Trial 87 finished with value: 0.8902272727272728 and parameters: {'n_estimators': 547, 'max_depth': 45, 'min_samples_split': 9, 'min_samples_leaf': 1, 'max_features': 'log2', 'bootstrap': True}. Best is trial 3 with value: 0.8911363636363635.
[I 2025-04-30 13:35:51,660] Trial 88 finished with value: 0.8906818181818184 and parameters: {'n_estimators': 621, 'max_depth': 43, 'min_samples_split': 9, 'min_samples_leaf': 1, 'max_features': 'log2', 'bootstrap': True}. Best is trial 3 with value: 0.8911363636363635.
[I 2025-04-30 13:36:04,885] Trial 89 finished with value: 0.8905681818181819 and parameters: {'n_estimators': 600, 'max_depth': 43, 'min_samples_split': 9, 'min_samples_leaf': 1, 'max_features': 'log2', 'bootstrap': True}. Best is trial 3 with value: 0.8911363636363635.
[I 2025-04-30 13:36:18,857] Trial 90 finished with value: 0.8888636363636364 and parameters: {'n_estimators': 650, 'max_depth': 47, 'min_samples_split': 10, 'min_samples_leaf': 2, 'max_features': 'log2', 'bootstrap': True}. Best is trial 3 with value: 0.8911363636363635.
[I 2025-04-30 13:36:32,553] Trial 91 finished with value: 0.8906818181818184 and parameters: {'n_estimators': 626, 'max_depth': 40, 'min_samples_split': 9, 'min_samples_leaf': 1, 'max_features': 'log2', 'bootstrap': True}. Best is trial 3 with value: 0.8911363636363635.
[I 2025-04-30 13:36:44,931] Trial 92 finished with value: 0.8910227272727272 and parameters: {'n_estimators': 565, 'max_depth': 40, 'min_samples_split': 9, 'min_samples_leaf': 1, 'max_features': 'log2', 'bootstrap': True}. Best is trial 3 with value: 0.8911363636363635.
[I 2025-04-30 13:36:57,199] Trial 93 finished with value: 0.8903409090909091 and parameters: {'n_estimators': 562, 'max_depth': 44, 'min_samples_split': 8, 'min_samples_leaf': 1, 'max_features': 'log2', 'bootstrap': True}. Best is trial 3 with value: 0.8911363636363635.
[I 2025-04-30 13:37:09,063] Trial 94 finished with value: 0.8902272727272728 and parameters: {'n_estimators': 539, 'max_depth': 40, 'min_samples_split': 9, 'min_samples_leaf': 1, 'max_features': 'log2', 'bootstrap': True}. Best is trial 3 with value: 0.8911363636363635.
[I 2025-04-30 13:37:24,692] Trial 95 finished with value: 0.8907954545454546 and parameters: {'n_estimators': 716, 'max_depth': 42, 'min_samples_split': 9, 'min_samples_leaf': 1, 'max_features': 'log2', 'bootstrap': True}. Best is trial 3 with value: 0.8911363636363635.
[I 2025-04-30 13:37:34,639] Trial 96 finished with value: 0.8893181818181818 and parameters: {'n_estimators': 466, 'max_depth': 50, 'min_samples_split': 8, 'min_samples_leaf': 2, 'max_features': 'sqrt', 'bootstrap': True}. Best is trial 3 with value: 0.8911363636363635.
[I 2025-04-30 13:37:45,613] Trial 97 finished with value: 0.8898863636363636 and parameters: {'n_estimators': 502, 'max_depth': 43, 'min_samples_split': 9, 'min_samples_leaf': 1, 'max_features': 'log2', 'bootstrap': True}. Best is trial 3 with value: 0.8911363636363635.
[I 2025-04-30 13:38:28,704] Trial 98 finished with value: 0.8871590909090908 and parameters: {'n_estimators': 601, 'max_depth': 49, 'min_samples_split': 9, 'min_samples_leaf': 1, 'max_features': None, 'bootstrap': True}. Best is trial 3 with value: 0.8911363636363635.
[I 2025-04-30 13:38:49,220] Trial 99 finished with value: 0.8895454545454544 and parameters: {'n_estimators': 672, 'max_depth': 42, 'min_samples_split': 8, 'min_samples_leaf': 1, 'max_features': 'log2', 'bootstrap': False}. Best is trial 3 with value: 0.8911363636363635.
[I 2025-04-30 13:39:05,276] Trial 100 finished with value: 0.8881818181818181 and parameters: {'n_estimators': 755, 'max_depth': 45, 'min_samples_split': 9, 'min_samples_leaf': 2, 'max_features': 'log2', 'bootstrap': True}. Best is trial 3 with value: 0.8911363636363635.
[I 2025-04-30 13:39:20,920] Trial 101 finished with value: 0.8904545454545454 and parameters: {'n_estimators': 721, 'max_depth': 40, 'min_samples_split': 10, 'min_samples_leaf': 1, 'max_features': 'log2', 'bootstrap': True}. Best is trial 3 with value: 0.8911363636363635.
[I 2025-04-30 13:39:36,560] Trial 102 finished with value: 0.8906818181818181 and parameters: {'n_estimators': 699, 'max_depth': 38, 'min_samples_split': 9, 'min_samples_leaf': 1, 'max_features': 'log2', 'bootstrap': True}. Best is trial 3 with value: 0.8911363636363635.
[I 2025-04-30 13:39:54,313] Trial 103 finished with value: 0.8898863636363636 and parameters: {'n_estimators': 795, 'max_depth': 37, 'min_samples_split': 10, 'min_samples_leaf': 1, 'max_features': 'log2', 'bootstrap': True}. Best is trial 3 with value: 0.8911363636363635.
[I 2025-04-30 13:40:09,028] Trial 104 finished with value: 0.8910227272727272 and parameters: {'n_estimators': 657, 'max_depth': 44, 'min_samples_split': 9, 'min_samples_leaf': 1, 'max_features': 'log2', 'bootstrap': True}. Best is trial 3 with value: 0.8911363636363635.
[I 2025-04-30 13:40:23,065] Trial 105 finished with value: 0.8889772727272727 and parameters: {'n_estimators': 649, 'max_depth': 44, 'min_samples_split': 9, 'min_samples_leaf': 2, 'max_features': 'log2', 'bootstrap': True}. Best is trial 3 with value: 0.8911363636363635.
[I 2025-04-30 13:40:35,801] Trial 106 finished with value: 0.8902272727272728 and parameters: {'n_estimators': 581, 'max_depth': 47, 'min_samples_split': 9, 'min_samples_leaf': 1, 'max_features': 'sqrt', 'bootstrap': True}. Best is trial 3 with value: 0.8911363636363635.
[I 2025-04-30 13:40:51,506] Trial 107 finished with value: 0.8889772727272728 and parameters: {'n_estimators': 739, 'max_depth': 42, 'min_samples_split': 8, 'min_samples_leaf': 2, 'max_features': 'log2', 'bootstrap': True}. Best is trial 3 with value: 0.8911363636363635.
[I 2025-04-30 13:41:04,904] Trial 108 finished with value: 0.8909090909090909 and parameters: {'n_estimators': 614, 'max_depth': 45, 'min_samples_split': 9, 'min_samples_leaf': 1, 'max_features': 'log2', 'bootstrap': True}. Best is trial 3 with value: 0.8911363636363635.
[I 2025-04-30 13:41:17,082] Trial 109 finished with value: 0.890340909090909 and parameters: {'n_estimators': 561, 'max_depth': 46, 'min_samples_split': 9, 'min_samples_leaf': 1, 'max_features': 'log2', 'bootstrap': True}. Best is trial 3 with value: 0.8911363636363635.
[I 2025-04-30 13:41:30,785] Trial 110 finished with value: 0.8906818181818181 and parameters: {'n_estimators': 628, 'max_depth': 47, 'min_samples_split': 9, 'min_samples_leaf': 1, 'max_features': 'log2', 'bootstrap': True}. Best is trial 3 with value: 0.8911363636363635.
[I 2025-04-30 13:41:43,987] Trial 111 finished with value: 0.8907954545454546 and parameters: {'n_estimators': 602, 'max_depth': 49, 'min_samples_split': 9, 'min_samples_leaf': 1, 'max_features': 'log2', 'bootstrap': True}. Best is trial 3 with value: 0.8911363636363635.
[I 2025-04-30 13:41:57,198] Trial 112 finished with value: 0.8907954545454546 and parameters: {'n_estimators': 606, 'max_depth': 49, 'min_samples_split': 9, 'min_samples_leaf': 1, 'max_features': 'log2', 'bootstrap': True}. Best is trial 3 with value: 0.8911363636363635.
[I 2025-04-30 13:42:10,128] Trial 113 finished with value: 0.8906818181818181 and parameters: {'n_estimators': 601, 'max_depth': 49, 'min_samples_split': 9, 'min_samples_leaf': 1, 'max_features': 'log2', 'bootstrap': True}. Best is trial 3 with value: 0.8911363636363635.
[I 2025-04-30 13:42:25,368] Trial 114 finished with value: 0.8920454545454545 and parameters: {'n_estimators': 675, 'max_depth': 49, 'min_samples_split': 6, 'min_samples_leaf': 1, 'max_features': 'log2', 'bootstrap': True}. Best is trial 114 with value: 0.8920454545454545.
[I 2025-04-30 13:42:40,033] Trial 115 finished with value: 0.8903409090909091 and parameters: {'n_estimators': 678, 'max_depth': 49, 'min_samples_split': 6, 'min_samples_leaf': 2, 'max_features': 'log2', 'bootstrap': True}. Best is trial 114 with value: 0.8920454545454545.
[I 2025-04-30 13:42:52,303] Trial 116 finished with value: 0.8847727272727273 and parameters: {'n_estimators': 656, 'max_depth': 49, 'min_samples_split': 6, 'min_samples_leaf': 10, 'max_features': 'log2', 'bootstrap': True}. Best is trial 114 with value: 0.8920454545454545.
[I 2025-04-30 13:43:05,265] Trial 117 finished with value: 0.8914772727272726 and parameters: {'n_estimators': 575, 'max_depth': 50, 'min_samples_split': 6, 'min_samples_leaf': 1, 'max_features': 'sqrt', 'bootstrap': True}. Best is trial 114 with value: 0.8920454545454545.
[I 2025-04-30 13:43:17,709] Trial 118 finished with value: 0.8914772727272726 and parameters: {'n_estimators': 552, 'max_depth': 48, 'min_samples_split': 6, 'min_samples_leaf': 1, 'max_features': 'sqrt', 'bootstrap': True}. Best is trial 114 with value: 0.8920454545454545.
[I 2025-04-30 13:43:33,961] Trial 119 finished with value: 0.8894318181818182 and parameters: {'n_estimators': 545, 'max_depth': 48, 'min_samples_split': 6, 'min_samples_leaf': 1, 'max_features': 'sqrt', 'bootstrap': False}. Best is trial 114 with value: 0.8920454545454545.
[I 2025-04-30 13:43:43,952] Trial 120 finished with value: 0.8847727272727273 and parameters: {'n_estimators': 524, 'max_depth': 50, 'min_samples_split': 6, 'min_samples_leaf': 9, 'max_features': 'sqrt', 'bootstrap': True}. Best is trial 114 with value: 0.8920454545454545.
[I 2025-04-30 13:43:56,960] Trial 121 finished with value: 0.8914772727272726 and parameters: {'n_estimators': 575, 'max_depth': 48, 'min_samples_split': 6, 'min_samples_leaf': 1, 'max_features': 'sqrt', 'bootstrap': True}. Best is trial 114 with value: 0.8920454545454545.
[I 2025-04-30 13:44:09,506] Trial 122 finished with value: 0.89 and parameters: {'n_estimators': 573, 'max_depth': 48, 'min_samples_split': 7, 'min_samples_leaf': 1, 'max_features': 'sqrt', 'bootstrap': True}. Best is trial 114 with value: 0.8920454545454545.
[I 2025-04-30 13:44:19,901] Trial 123 finished with value: 0.8895454545454546 and parameters: {'n_estimators': 457, 'max_depth': 48, 'min_samples_split': 5, 'min_samples_leaf': 1, 'max_features': 'sqrt', 'bootstrap': True}. Best is trial 114 with value: 0.8920454545454545.
[I 2025-04-30 13:44:32,655] Trial 124 finished with value: 0.8909090909090909 and parameters: {'n_estimators': 556, 'max_depth': 46, 'min_samples_split': 6, 'min_samples_leaf': 1, 'max_features': 'sqrt', 'bootstrap': True}. Best is trial 114 with value: 0.8920454545454545.
[I 2025-04-30 13:44:44,439] Trial 125 finished with value: 0.8911363636363635 and parameters: {'n_estimators': 505, 'max_depth': 45, 'min_samples_split': 6, 'min_samples_leaf': 1, 'max_features': 'sqrt', 'bootstrap': True}. Best is trial 114 with value: 0.8920454545454545.
[I 2025-04-30 13:44:53,892] Trial 126 finished with value: 0.8901136363636365 and parameters: {'n_estimators': 432, 'max_depth': 46, 'min_samples_split': 6, 'min_samples_leaf': 2, 'max_features': 'sqrt', 'bootstrap': True}. Best is trial 114 with value: 0.8920454545454545.
[I 2025-04-30 13:45:05,518] Trial 127 finished with value: 0.8913636363636364 and parameters: {'n_estimators': 497, 'max_depth': 45, 'min_samples_split': 6, 'min_samples_leaf': 1, 'max_features': 'sqrt', 'bootstrap': True}. Best is trial 114 with value: 0.8920454545454545.
[I 2025-04-30 13:45:16,799] Trial 128 finished with value: 0.8913636363636364 and parameters: {'n_estimators': 493, 'max_depth': 47, 'min_samples_split': 6, 'min_samples_leaf': 1, 'max_features': 'sqrt', 'bootstrap': True}. Best is trial 114 with value: 0.8920454545454545.
[I 2025-04-30 13:45:27,992] Trial 129 finished with value: 0.89125 and parameters: {'n_estimators': 498, 'max_depth': 47, 'min_samples_split': 6, 'min_samples_leaf': 1, 'max_features': 'sqrt', 'bootstrap': True}. Best is trial 114 with value: 0.8920454545454545.
[I 2025-04-30 13:45:37,584] Trial 130 finished with value: 0.8878409090909092 and parameters: {'n_estimators': 485, 'max_depth': 47, 'min_samples_split': 6, 'min_samples_leaf': 6, 'max_features': 'sqrt', 'bootstrap': True}. Best is trial 114 with value: 0.8920454545454545.
[I 2025-04-30 13:45:46,559] Trial 131 finished with value: 0.8909090909090909 and parameters: {'n_estimators': 404, 'max_depth': 45, 'min_samples_split': 6, 'min_samples_leaf': 1, 'max_features': 'sqrt', 'bootstrap': True}. Best is trial 114 with value: 0.8920454545454545.
[I 2025-04-30 13:45:57,572] Trial 132 finished with value: 0.8899999999999999 and parameters: {'n_estimators': 501, 'max_depth': 47, 'min_samples_split': 7, 'min_samples_leaf': 1, 'max_features': 'sqrt', 'bootstrap': True}. Best is trial 114 with value: 0.8920454545454545.
[I 2025-04-30 13:46:07,977] Trial 133 finished with value: 0.8905681818181816 and parameters: {'n_estimators': 455, 'max_depth': 50, 'min_samples_split': 6, 'min_samples_leaf': 1, 'max_features': 'sqrt', 'bootstrap': True}. Best is trial 114 with value: 0.8920454545454545.
[I 2025-04-30 13:46:19,861] Trial 134 finished with value: 0.8894318181818182 and parameters: {'n_estimators': 525, 'max_depth': 45, 'min_samples_split': 5, 'min_samples_leaf': 1, 'max_features': 'sqrt', 'bootstrap': True}. Best is trial 114 with value: 0.8920454545454545.
[I 2025-04-30 13:46:30,387] Trial 135 finished with value: 0.8903409090909091 and parameters: {'n_estimators': 494, 'max_depth': 48, 'min_samples_split': 6, 'min_samples_leaf': 2, 'max_features': 'sqrt', 'bootstrap': True}. Best is trial 114 with value: 0.8920454545454545.
[I 2025-04-30 13:46:40,705] Trial 136 finished with value: 0.89 and parameters: {'n_estimators': 469, 'max_depth': 44, 'min_samples_split': 7, 'min_samples_leaf': 1, 'max_features': 'sqrt', 'bootstrap': True}. Best is trial 114 with value: 0.8920454545454545.
[I 2025-04-30 13:46:52,469] Trial 137 finished with value: 0.8919318181818181 and parameters: {'n_estimators': 523, 'max_depth': 46, 'min_samples_split': 6, 'min_samples_leaf': 1, 'max_features': 'sqrt', 'bootstrap': True}. Best is trial 114 with value: 0.8920454545454545.
[I 2025-04-30 13:47:04,177] Trial 138 finished with value: 0.8919318181818182 and parameters: {'n_estimators': 519, 'max_depth': 47, 'min_samples_split': 6, 'min_samples_leaf': 1, 'max_features': 'sqrt', 'bootstrap': True}. Best is trial 114 with value: 0.8920454545454545.
[I 2025-04-30 13:47:15,368] Trial 139 finished with value: 0.8904545454545454 and parameters: {'n_estimators': 520, 'max_depth': 47, 'min_samples_split': 6, 'min_samples_leaf': 2, 'max_features': 'sqrt', 'bootstrap': True}. Best is trial 114 with value: 0.8920454545454545.
[I 2025-04-30 13:47:27,640] Trial 140 finished with value: 0.8915909090909091 and parameters: {'n_estimators': 534, 'max_depth': 48, 'min_samples_split': 6, 'min_samples_leaf': 1, 'max_features': 'sqrt', 'bootstrap': True}. Best is trial 114 with value: 0.8920454545454545.
[I 2025-04-30 13:47:39,731] Trial 141 finished with value: 0.8918181818181818 and parameters: {'n_estimators': 536, 'max_depth': 48, 'min_samples_split': 6, 'min_samples_leaf': 1, 'max_features': 'sqrt', 'bootstrap': True}. Best is trial 114 with value: 0.8920454545454545.
[I 2025-04-30 13:47:51,897] Trial 142 finished with value: 0.8913636363636364 and parameters: {'n_estimators': 540, 'max_depth': 50, 'min_samples_split': 6, 'min_samples_leaf': 1, 'max_features': 'sqrt', 'bootstrap': True}. Best is trial 114 with value: 0.8920454545454545.
[I 2025-04-30 13:48:03,760] Trial 143 finished with value: 0.8917045454545456 and parameters: {'n_estimators': 530, 'max_depth': 50, 'min_samples_split': 6, 'min_samples_leaf': 1, 'max_features': 'sqrt', 'bootstrap': True}. Best is trial 114 with value: 0.8920454545454545.
[I 2025-04-30 13:48:14,921] Trial 144 finished with value: 0.8873863636363637 and parameters: {'n_estimators': 531, 'max_depth': 50, 'min_samples_split': 6, 'min_samples_leaf': 5, 'max_features': 'sqrt', 'bootstrap': True}. Best is trial 114 with value: 0.8920454545454545.
[I 2025-04-30 13:48:26,330] Trial 145 finished with value: 0.89125 and parameters: {'n_estimators': 508, 'max_depth': 49, 'min_samples_split': 6, 'min_samples_leaf': 1, 'max_features': 'sqrt', 'bootstrap': True}. Best is trial 114 with value: 0.8920454545454545.
[I 2025-04-30 13:48:37,364] Trial 146 finished with value: 0.8910227272727272 and parameters: {'n_estimators': 489, 'max_depth': 49, 'min_samples_split': 6, 'min_samples_leaf': 1, 'max_features': 'sqrt', 'bootstrap': True}. Best is trial 114 with value: 0.8920454545454545.
[I 2025-04-30 13:48:47,392] Trial 147 finished with value: 0.890340909090909 and parameters: {'n_estimators': 447, 'max_depth': 50, 'min_samples_split': 6, 'min_samples_leaf': 1, 'max_features': 'sqrt', 'bootstrap': True}. Best is trial 114 with value: 0.8920454545454545.
[I 2025-04-30 13:49:03,568] Trial 148 finished with value: 0.889090909090909 and parameters: {'n_estimators': 538, 'max_depth': 48, 'min_samples_split': 6, 'min_samples_leaf': 1, 'max_features': 'sqrt', 'bootstrap': False}. Best is trial 114 with value: 0.8920454545454545.
[I 2025-04-30 13:49:14,430] Trial 149 finished with value: 0.89 and parameters: {'n_estimators': 479, 'max_depth': 49, 'min_samples_split': 5, 'min_samples_leaf': 1, 'max_features': 'sqrt', 'bootstrap': True}. Best is trial 114 with value: 0.8920454545454545.
[I 2025-04-30 13:49:25,977] Trial 150 finished with value: 0.8901136363636365 and parameters: {'n_estimators': 512, 'max_depth': 47, 'min_samples_split': 7, 'min_samples_leaf': 1, 'max_features': 'sqrt', 'bootstrap': True}. Best is trial 114 with value: 0.8920454545454545.
[I 2025-04-30 13:49:37,525] Trial 151 finished with value: 0.89125 and parameters: {'n_estimators': 507, 'max_depth': 50, 'min_samples_split': 6, 'min_samples_leaf': 1, 'max_features': 'sqrt', 'bootstrap': True}. Best is trial 114 with value: 0.8920454545454545.
[I 2025-04-30 13:49:49,822] Trial 152 finished with value: 0.8917045454545454 and parameters: {'n_estimators': 549, 'max_depth': 50, 'min_samples_split': 6, 'min_samples_leaf': 1, 'max_features': 'sqrt', 'bootstrap': True}. Best is trial 114 with value: 0.8920454545454545.
[I 2025-04-30 13:50:02,279] Trial 153 finished with value: 0.8914772727272726 and parameters: {'n_estimators': 550, 'max_depth': 50, 'min_samples_split': 6, 'min_samples_leaf': 1, 'max_features': 'sqrt', 'bootstrap': True}. Best is trial 114 with value: 0.8920454545454545.
[I 2025-04-30 13:50:14,707] Trial 154 finished with value: 0.8917045454545456 and parameters: {'n_estimators': 548, 'max_depth': 48, 'min_samples_split': 6, 'min_samples_leaf': 1, 'max_features': 'sqrt', 'bootstrap': True}. Best is trial 114 with value: 0.8920454545454545.
[I 2025-04-30 13:50:26,999] Trial 155 finished with value: 0.8911363636363635 and parameters: {'n_estimators': 551, 'max_depth': 48, 'min_samples_split': 6, 'min_samples_leaf': 1, 'max_features': 'sqrt', 'bootstrap': True}. Best is trial 114 with value: 0.8920454545454545.
[I 2025-04-30 13:50:39,172] Trial 156 finished with value: 0.8894318181818182 and parameters: {'n_estimators': 532, 'max_depth': 48, 'min_samples_split': 5, 'min_samples_leaf': 1, 'max_features': 'sqrt', 'bootstrap': True}. Best is trial 114 with value: 0.8920454545454545.
[I 2025-04-30 13:50:52,575] Trial 157 finished with value: 0.8913636363636362 and parameters: {'n_estimators': 580, 'max_depth': 50, 'min_samples_split': 6, 'min_samples_leaf': 1, 'max_features': 'sqrt', 'bootstrap': True}. Best is trial 114 with value: 0.8920454545454545.
[I 2025-04-30 13:51:06,017] Trial 158 finished with value: 0.8907954545454546 and parameters: {'n_estimators': 584, 'max_depth': 50, 'min_samples_split': 6, 'min_samples_leaf': 1, 'max_features': 'sqrt', 'bootstrap': True}. Best is trial 114 with value: 0.8920454545454545.
[I 2025-04-30 13:51:18,236] Trial 159 finished with value: 0.8901136363636365 and parameters: {'n_estimators': 547, 'max_depth': 49, 'min_samples_split': 6, 'min_samples_leaf': 2, 'max_features': 'sqrt', 'bootstrap': True}. Best is trial 114 with value: 0.8920454545454545.
