[I 2025-04-30 13:51:31,203] Trial 160 finished with value: 0.8917045454545454 and parameters: {'n_estimators': 567, 'max_depth': 50, 'min_samples_split': 6, 'min_samples_leaf': 1, 'max_features': 'sqrt', 'bootstrap': True}. Best is trial 114 with value: 0.8920454545454545.
[I 2025-04-30 13:51:44,168] Trial 161 finished with value: 0.8915909090909091 and parameters: {'n_estimators': 576, 'max_depth': 50, 'min_samples_split': 6, 'min_samples_leaf': 1, 'max_features': 'sqrt', 'bootstrap': True}. Best is trial 114 with value: 0.8920454545454545.
[I 2025-04-30 13:51:56,930] Trial 162 finished with value: 0.8914772727272726 and parameters: {'n_estimators': 564, 'max_depth': 48, 'min_samples_split': 6, 'min_samples_leaf': 1, 'max_features': 'sqrt', 'bootstrap': True}. Best is trial 114 with value: 0.8920454545454545.
[I 2025-04-30 13:52:09,515] Trial 163 finished with value: 0.8914772727272726 and parameters: {'n_estimators': 564, 'max_depth': 48, 'min_samples_split': 6, 'min_samples_leaf': 1, 'max_features': 'sqrt', 'bootstrap': True}. Best is trial 114 with value: 0.8920454545454545.
[I 2025-04-30 13:52:22,327] Trial 164 finished with value: 0.8917045454545454 and parameters: {'n_estimators': 568, 'max_depth': 48, 'min_samples_split': 6, 'min_samples_leaf': 1, 'max_features': 'sqrt', 'bootstrap': True}. Best is trial 114 with value: 0.8920454545454545.
[I 2025-04-30 13:52:35,099] Trial 165 finished with value: 0.8917045454545454 and parameters: {'n_estimators': 567, 'max_depth': 48, 'min_samples_split': 6, 'min_samples_leaf': 1, 'max_features': 'sqrt', 'bootstrap': True}. Best is trial 114 with value: 0.8920454545454545.
[I 2025-04-30 13:52:48,037] Trial 166 finished with value: 0.8915909090909091 and parameters: {'n_estimators': 571, 'max_depth': 46, 'min_samples_split': 6, 'min_samples_leaf': 1, 'max_features': 'sqrt', 'bootstrap': True}. Best is trial 114 with value: 0.8920454545454545.
[I 2025-04-30 13:53:01,033] Trial 167 finished with value: 0.89125 and parameters: {'n_estimators': 581, 'max_depth': 46, 'min_samples_split': 6, 'min_samples_leaf': 1, 'max_features': 'sqrt', 'bootstrap': True}. Best is trial 114 with value: 0.8920454545454545.
[I 2025-04-30 13:53:17,025] Trial 168 finished with value: 0.8897727272727274 and parameters: {'n_estimators': 552, 'max_depth': 49, 'min_samples_split': 5, 'min_samples_leaf': 1, 'max_features': 'sqrt', 'bootstrap': True}. Best is trial 114 with value: 0.8920454545454545.
[I 2025-04-30 13:53:30,098] Trial 169 finished with value: 0.8917045454545456 and parameters: {'n_estimators': 530, 'max_depth': 49, 'min_samples_split': 6, 'min_samples_leaf': 1, 'max_features': 'sqrt', 'bootstrap': True}. Best is trial 114 with value: 0.8920454545454545.
[I 2025-04-30 13:53:45,453] Trial 170 finished with value: 0.8893181818181819 and parameters: {'n_estimators': 591, 'max_depth': 46, 'min_samples_split': 7, 'min_samples_leaf': 2, 'max_features': 'sqrt', 'bootstrap': True}. Best is trial 114 with value: 0.8920454545454545.
[I 2025-04-30 13:53:58,763] Trial 171 finished with value: 0.8915909090909091 and parameters: {'n_estimators': 526, 'max_depth': 49, 'min_samples_split': 6, 'min_samples_leaf': 1, 'max_features': 'sqrt', 'bootstrap': True}. Best is trial 114 with value: 0.8920454545454545.
[I 2025-04-30 13:54:11,033] Trial 172 finished with value: 0.8917045454545456 and parameters: {'n_estimators': 527, 'max_depth': 49, 'min_samples_split': 6, 'min_samples_leaf': 1, 'max_features': 'sqrt', 'bootstrap': True}. Best is trial 114 with value: 0.8920454545454545.
[I 2025-04-30 13:54:23,373] Trial 173 finished with value: 0.8915909090909091 and parameters: {'n_estimators': 525, 'max_depth': 49, 'min_samples_split': 6, 'min_samples_leaf': 1, 'max_features': 'sqrt', 'bootstrap': True}. Best is trial 114 with value: 0.8920454545454545.
[I 2025-04-30 13:54:36,445] Trial 174 finished with value: 0.8917045454545454 and parameters: {'n_estimators': 567, 'max_depth': 49, 'min_samples_split': 6, 'min_samples_leaf': 1, 'max_features': 'sqrt', 'bootstrap': True}. Best is trial 114 with value: 0.8920454545454545.
[I 2025-04-30 13:54:48,392] Trial 175 finished with value: 0.8920454545454545 and parameters: {'n_estimators': 521, 'max_depth': 47, 'min_samples_split': 6, 'min_samples_leaf': 1, 'max_features': 'sqrt', 'bootstrap': True}. Best is trial 114 with value: 0.8920454545454545.
[I 2025-04-30 13:55:00,329] Trial 176 finished with value: 0.8918181818181818 and parameters: {'n_estimators': 524, 'max_depth': 47, 'min_samples_split': 6, 'min_samples_leaf': 1, 'max_features': 'sqrt', 'bootstrap': True}. Best is trial 114 with value: 0.8920454545454545.
[I 2025-04-30 13:55:15,766] Trial 177 finished with value: 0.8889772727272728 and parameters: {'n_estimators': 521, 'max_depth': 47, 'min_samples_split': 7, 'min_samples_leaf': 1, 'max_features': 'sqrt', 'bootstrap': False}. Best is trial 114 with value: 0.8920454545454545.
[I 2025-04-30 13:55:27,932] Trial 178 finished with value: 0.8917045454545454 and parameters: {'n_estimators': 538, 'max_depth': 46, 'min_samples_split': 6, 'min_samples_leaf': 1, 'max_features': 'sqrt', 'bootstrap': True}. Best is trial 114 with value: 0.8920454545454545.
[I 2025-04-30 13:55:40,036] Trial 179 finished with value: 0.8917045454545454 and parameters: {'n_estimators': 537, 'max_depth': 48, 'min_samples_split': 6, 'min_samples_leaf': 1, 'max_features': 'sqrt', 'bootstrap': True}. Best is trial 114 with value: 0.8920454545454545.
[I 2025-04-30 13:55:50,128] Trial 180 finished with value: 0.8901136363636363 and parameters: {'n_estimators': 471, 'max_depth': 46, 'min_samples_split': 6, 'min_samples_leaf': 2, 'max_features': 'sqrt', 'bootstrap': True}. Best is trial 114 with value: 0.8920454545454545.
[I 2025-04-30 13:56:02,252] Trial 181 finished with value: 0.8919318181818181 and parameters: {'n_estimators': 532, 'max_depth': 47, 'min_samples_split': 6, 'min_samples_leaf': 1, 'max_features': 'sqrt', 'bootstrap': True}. Best is trial 114 with value: 0.8920454545454545.
[I 2025-04-30 13:56:14,390] Trial 182 finished with value: 0.8913636363636364 and parameters: {'n_estimators': 542, 'max_depth': 47, 'min_samples_split': 6, 'min_samples_leaf': 1, 'max_features': 'sqrt', 'bootstrap': True}. Best is trial 114 with value: 0.8920454545454545.
[I 2025-04-30 13:56:26,110] Trial 183 finished with value: 0.892159090909091 and parameters: {'n_estimators': 522, 'max_depth': 48, 'min_samples_split': 6, 'min_samples_leaf': 1, 'max_features': 'sqrt', 'bootstrap': True}. Best is trial 183 with value: 0.892159090909091.
[I 2025-04-30 13:56:38,171] Trial 184 finished with value: 0.8893181818181818 and parameters: {'n_estimators': 511, 'max_depth': 47, 'min_samples_split': 5, 'min_samples_leaf': 1, 'max_features': 'sqrt', 'bootstrap': True}. Best is trial 183 with value: 0.892159090909091.
[I 2025-04-30 13:56:50,225] Trial 185 finished with value: 0.8920454545454545 and parameters: {'n_estimators': 521, 'max_depth': 48, 'min_samples_split': 6, 'min_samples_leaf': 1, 'max_features': 'sqrt', 'bootstrap': True}. Best is trial 183 with value: 0.892159090909091.
[I 2025-04-30 13:57:01,289] Trial 186 finished with value: 0.8911363636363635 and parameters: {'n_estimators': 480, 'max_depth': 49, 'min_samples_split': 6, 'min_samples_leaf': 1, 'max_features': 'sqrt', 'bootstrap': True}. Best is trial 183 with value: 0.892159090909091.
[I 2025-04-30 13:57:13,200] Trial 187 finished with value: 0.8917045454545454 and parameters: {'n_estimators': 517, 'max_depth': 46, 'min_samples_split': 6, 'min_samples_leaf': 1, 'max_features': 'sqrt', 'bootstrap': True}. Best is trial 183 with value: 0.892159090909091.
[I 2025-04-30 13:57:52,942] Trial 188 finished with value: 0.8853409090909091 and parameters: {'n_estimators': 553, 'max_depth': 47, 'min_samples_split': 6, 'min_samples_leaf': 1, 'max_features': None, 'bootstrap': True}. Best is trial 183 with value: 0.892159090909091.
[I 2025-04-30 13:58:04,805] Trial 189 finished with value: 0.8920454545454545 and parameters: {'n_estimators': 521, 'max_depth': 49, 'min_samples_split': 6, 'min_samples_leaf': 1, 'max_features': 'sqrt', 'bootstrap': True}. Best is trial 183 with value: 0.892159090909091.
[I 2025-04-30 13:58:16,472] Trial 190 finished with value: 0.8914772727272728 and parameters: {'n_estimators': 514, 'max_depth': 49, 'min_samples_split': 6, 'min_samples_leaf': 1, 'max_features': 'sqrt', 'bootstrap': True}. Best is trial 183 with value: 0.892159090909091.
[I 2025-04-30 13:58:28,321] Trial 191 finished with value: 0.8917045454545456 and parameters: {'n_estimators': 530, 'max_depth': 48, 'min_samples_split': 6, 'min_samples_leaf': 1, 'max_features': 'sqrt', 'bootstrap': True}. Best is trial 183 with value: 0.892159090909091.
[I 2025-04-30 13:58:39,630] Trial 192 finished with value: 0.8877272727272727 and parameters: {'n_estimators': 527, 'max_depth': 49, 'min_samples_split': 6, 'min_samples_leaf': 4, 'max_features': 'sqrt', 'bootstrap': True}. Best is trial 183 with value: 0.892159090909091.
[I 2025-04-30 13:58:51,021] Trial 193 finished with value: 0.8910227272727272 and parameters: {'n_estimators': 490, 'max_depth': 48, 'min_samples_split': 6, 'min_samples_leaf': 1, 'max_features': 'sqrt', 'bootstrap': True}. Best is trial 183 with value: 0.892159090909091.
[I 2025-04-30 13:58:58,669] Trial 194 finished with value: 0.8695454545454545 and parameters: {'n_estimators': 557, 'max_depth': 5, 'min_samples_split': 6, 'min_samples_leaf': 1, 'max_features': 'sqrt', 'bootstrap': True}. Best is trial 183 with value: 0.892159090909091.
[I 2025-04-30 13:59:10,388] Trial 195 finished with value: 0.8902272727272728 and parameters: {'n_estimators': 516, 'max_depth': 48, 'min_samples_split': 7, 'min_samples_leaf': 1, 'max_features': 'sqrt', 'bootstrap': True}. Best is trial 183 with value: 0.892159090909091.
[I 2025-04-30 13:59:22,126] Trial 196 finished with value: 0.8913636363636364 and parameters: {'n_estimators': 493, 'max_depth': 50, 'min_samples_split': 6, 'min_samples_leaf': 1, 'max_features': 'sqrt', 'bootstrap': True}. Best is trial 183 with value: 0.892159090909091.
[I 2025-04-30 13:59:35,009] Trial 197 finished with value: 0.8914772727272726 and parameters: {'n_estimators': 561, 'max_depth': 47, 'min_samples_split': 6, 'min_samples_leaf': 1, 'max_features': 'sqrt', 'bootstrap': True}. Best is trial 183 with value: 0.892159090909091.
[I 2025-04-30 13:59:47,023] Trial 198 finished with value: 0.8901136363636363 and parameters: {'n_estimators': 537, 'max_depth': 49, 'min_samples_split': 7, 'min_samples_leaf': 1, 'max_features': 'sqrt', 'bootstrap': True}. Best is trial 183 with value: 0.892159090909091.
[I 2025-04-30 13:59:50,743] Trial 199 finished with value: 0.8898863636363636 and parameters: {'n_estimators': 159, 'max_depth': 48, 'min_samples_split': 5, 'min_samples_leaf': 1, 'max_features': 'sqrt', 'bootstrap': True}. Best is trial 183 with value: 0.892159090909091.
[I 2025-04-30 14:00:01,932] Trial 200 finished with value: 0.89 and parameters: {'n_estimators': 512, 'max_depth': 49, 'min_samples_split': 6, 'min_samples_leaf': 2, 'max_features': 'sqrt', 'bootstrap': True}. Best is trial 183 with value: 0.892159090909091.
[I 2025-04-30 14:00:14,145] Trial 201 finished with value: 0.8918181818181818 and parameters: {'n_estimators': 536, 'max_depth': 47, 'min_samples_split': 6, 'min_samples_leaf': 1, 'max_features': 'sqrt', 'bootstrap': True}. Best is trial 183 with value: 0.892159090909091.
[I 2025-04-30 14:00:26,295] Trial 202 finished with value: 0.8917045454545454 and parameters: {'n_estimators': 537, 'max_depth': 47, 'min_samples_split': 6, 'min_samples_leaf': 1, 'max_features': 'sqrt', 'bootstrap': True}. Best is trial 183 with value: 0.892159090909091.
[I 2025-04-30 14:00:39,009] Trial 203 finished with value: 0.8911363636363635 and parameters: {'n_estimators': 560, 'max_depth': 48, 'min_samples_split': 6, 'min_samples_leaf': 1, 'max_features': 'sqrt', 'bootstrap': True}. Best is trial 183 with value: 0.892159090909091.
[I 2025-04-30 14:00:50,379] Trial 204 finished with value: 0.89125 and parameters: {'n_estimators': 503, 'max_depth': 50, 'min_samples_split': 6, 'min_samples_leaf': 1, 'max_features': 'sqrt', 'bootstrap': True}. Best is trial 183 with value: 0.892159090909091.
[I 2025-04-30 14:01:01,217] Trial 205 finished with value: 0.8905681818181819 and parameters: {'n_estimators': 467, 'max_depth': 47, 'min_samples_split': 6, 'min_samples_leaf': 1, 'max_features': 'sqrt', 'bootstrap': True}. Best is trial 183 with value: 0.892159090909091.
[I 2025-04-30 14:01:13,267] Trial 206 finished with value: 0.8917045454545456 and parameters: {'n_estimators': 528, 'max_depth': 49, 'min_samples_split': 6, 'min_samples_leaf': 1, 'max_features': 'sqrt', 'bootstrap': True}. Best is trial 183 with value: 0.892159090909091.
[I 2025-04-30 14:01:25,445] Trial 207 finished with value: 0.8919318181818181 and parameters: {'n_estimators': 523, 'max_depth': 48, 'min_samples_split': 6, 'min_samples_leaf': 1, 'max_features': 'sqrt', 'bootstrap': True}. Best is trial 183 with value: 0.892159090909091.
[I 2025-04-30 14:01:37,316] Trial 208 finished with value: 0.8915909090909091 and parameters: {'n_estimators': 525, 'max_depth': 50, 'min_samples_split': 6, 'min_samples_leaf': 1, 'max_features': 'sqrt', 'bootstrap': True}. Best is trial 183 with value: 0.892159090909091.
[I 2025-04-30 14:01:51,809] Trial 209 finished with value: 0.889090909090909 and parameters: {'n_estimators': 484, 'max_depth': 47, 'min_samples_split': 6, 'min_samples_leaf': 1, 'max_features': 'sqrt', 'bootstrap': False}. Best is trial 183 with value: 0.892159090909091.
[I 2025-04-30 14:02:03,296] Trial 210 finished with value: 0.8909090909090909 and parameters: {'n_estimators': 504, 'max_depth': 48, 'min_samples_split': 6, 'min_samples_leaf': 1, 'max_features': 'sqrt', 'bootstrap': True}. Best is trial 183 with value: 0.892159090909091.
[I 2025-04-30 14:02:15,580] Trial 211 finished with value: 0.89125 and parameters: {'n_estimators': 544, 'max_depth': 48, 'min_samples_split': 6, 'min_samples_leaf': 1, 'max_features': 'sqrt', 'bootstrap': True}. Best is trial 183 with value: 0.892159090909091.
[I 2025-04-30 14:02:27,330] Trial 212 finished with value: 0.892159090909091 and parameters: {'n_estimators': 522, 'max_depth': 49, 'min_samples_split': 6, 'min_samples_leaf': 1, 'max_features': 'sqrt', 'bootstrap': True}. Best is trial 183 with value: 0.892159090909091.
[I 2025-04-30 14:02:39,771] Trial 213 finished with value: 0.8919318181818181 and parameters: {'n_estimators': 523, 'max_depth': 49, 'min_samples_split': 6, 'min_samples_leaf': 1, 'max_features': 'sqrt', 'bootstrap': True}. Best is trial 183 with value: 0.892159090909091.
[I 2025-04-30 14:02:52,165] Trial 214 finished with value: 0.892159090909091 and parameters: {'n_estimators': 522, 'max_depth': 49, 'min_samples_split': 6, 'min_samples_leaf': 1, 'max_features': 'sqrt', 'bootstrap': True}. Best is trial 183 with value: 0.892159090909091.
[I 2025-04-30 14:03:04,425] Trial 215 finished with value: 0.8919318181818182 and parameters: {'n_estimators': 520, 'max_depth': 49, 'min_samples_split': 6, 'min_samples_leaf': 1, 'max_features': 'sqrt', 'bootstrap': True}. Best is trial 183 with value: 0.892159090909091.
[I 2025-04-30 14:03:16,495] Trial 216 finished with value: 0.8914772727272726 and parameters: {'n_estimators': 518, 'max_depth': 49, 'min_samples_split': 6, 'min_samples_leaf': 1, 'max_features': 'sqrt', 'bootstrap': True}. Best is trial 183 with value: 0.892159090909091.
[I 2025-04-30 14:03:52,539] Trial 217 finished with value: 0.8851136363636363 and parameters: {'n_estimators': 499, 'max_depth': 46, 'min_samples_split': 6, 'min_samples_leaf': 1, 'max_features': None, 'bootstrap': True}. Best is trial 183 with value: 0.892159090909091.
[I 2025-04-30 14:04:04,409] Trial 218 finished with value: 0.8915909090909091 and parameters: {'n_estimators': 525, 'max_depth': 47, 'min_samples_split': 6, 'min_samples_leaf': 1, 'max_features': 'sqrt', 'bootstrap': True}. Best is trial 183 with value: 0.892159090909091.
[I 2025-04-30 14:04:15,095] Trial 219 finished with value: 0.8910227272727272 and parameters: {'n_estimators': 481, 'max_depth': 49, 'min_samples_split': 6, 'min_samples_leaf': 1, 'max_features': 'sqrt', 'bootstrap': True}. Best is trial 183 with value: 0.892159090909091.
[I 2025-04-30 14:04:27,075] Trial 220 finished with value: 0.8917045454545456 and parameters: {'n_estimators': 527, 'max_depth': 46, 'min_samples_split': 6, 'min_samples_leaf': 1, 'max_features': 'sqrt', 'bootstrap': True}. Best is trial 183 with value: 0.892159090909091.
[I 2025-04-30 14:04:39,060] Trial 221 finished with value: 0.8918181818181818 and parameters: {'n_estimators': 529, 'max_depth': 45, 'min_samples_split': 6, 'min_samples_leaf': 1, 'max_features': 'sqrt', 'bootstrap': True}. Best is trial 183 with value: 0.892159090909091.
[I 2025-04-30 14:04:50,413] Trial 222 finished with value: 0.8913636363636364 and parameters: {'n_estimators': 510, 'max_depth': 45, 'min_samples_split': 6, 'min_samples_leaf': 1, 'max_features': 'sqrt', 'bootstrap': True}. Best is trial 183 with value: 0.892159090909091.
[I 2025-04-30 14:05:02,512] Trial 223 finished with value: 0.8919318181818181 and parameters: {'n_estimators': 532, 'max_depth': 48, 'min_samples_split': 6, 'min_samples_leaf': 1, 'max_features': 'sqrt', 'bootstrap': True}. Best is trial 183 with value: 0.892159090909091.
[I 2025-04-30 14:05:13,580] Trial 224 finished with value: 0.8913636363636364 and parameters: {'n_estimators': 493, 'max_depth': 47, 'min_samples_split': 6, 'min_samples_leaf': 1, 'max_features': 'sqrt', 'bootstrap': True}. Best is trial 183 with value: 0.892159090909091.
[I 2025-04-30 14:05:25,603] Trial 225 finished with value: 0.8911363636363635 and parameters: {'n_estimators': 541, 'max_depth': 48, 'min_samples_split': 6, 'min_samples_leaf': 1, 'max_features': 'sqrt', 'bootstrap': True}. Best is trial 183 with value: 0.892159090909091.
[I 2025-04-30 14:05:37,004] Trial 226 finished with value: 0.8913636363636364 and parameters: {'n_estimators': 511, 'max_depth': 46, 'min_samples_split': 6, 'min_samples_leaf': 1, 'max_features': 'sqrt', 'bootstrap': True}. Best is trial 183 with value: 0.892159090909091.
[I 2025-04-30 14:05:59,303] Trial 227 finished with value: 0.8910227272727272 and parameters: {'n_estimators': 983, 'max_depth': 18, 'min_samples_split': 6, 'min_samples_leaf': 1, 'max_features': 'sqrt', 'bootstrap': True}. Best is trial 183 with value: 0.892159090909091.
[I 2025-04-30 14:06:11,184] Trial 228 finished with value: 0.8917045454545454 and parameters: {'n_estimators': 531, 'max_depth': 48, 'min_samples_split': 6, 'min_samples_leaf': 1, 'max_features': 'sqrt', 'bootstrap': True}. Best is trial 183 with value: 0.892159090909091.
[I 2025-04-30 14:06:22,303] Trial 229 finished with value: 0.8913636363636364 and parameters: {'n_estimators': 501, 'max_depth': 47, 'min_samples_split': 6, 'min_samples_leaf': 1, 'max_features': 'sqrt', 'bootstrap': True}. Best is trial 183 with value: 0.892159090909091.
[I 2025-04-30 14:06:34,816] Trial 230 finished with value: 0.89125 and parameters: {'n_estimators': 546, 'max_depth': 49, 'min_samples_split': 6, 'min_samples_leaf': 1, 'max_features': 'sqrt', 'bootstrap': True}. Best is trial 183 with value: 0.892159090909091.
[I 2025-04-30 14:06:47,035] Trial 231 finished with value: 0.8915909090909091 and parameters: {'n_estimators': 525, 'max_depth': 49, 'min_samples_split': 6, 'min_samples_leaf': 1, 'max_features': 'sqrt', 'bootstrap': True}. Best is trial 183 with value: 0.892159090909091.
[I 2025-04-30 14:06:58,976] Trial 232 finished with value: 0.8919318181818181 and parameters: {'n_estimators': 523, 'max_depth': 49, 'min_samples_split': 6, 'min_samples_leaf': 1, 'max_features': 'sqrt', 'bootstrap': True}. Best is trial 183 with value: 0.892159090909091.
[I 2025-04-30 14:07:11,126] Trial 233 finished with value: 0.8915909090909091 and parameters: {'n_estimators': 516, 'max_depth': 48, 'min_samples_split': 6, 'min_samples_leaf': 1, 'max_features': 'sqrt', 'bootstrap': True}. Best is trial 183 with value: 0.892159090909091.
[I 2025-04-30 14:07:23,437] Trial 234 finished with value: 0.8913636363636364 and parameters: {'n_estimators': 543, 'max_depth': 49, 'min_samples_split': 6, 'min_samples_leaf': 1, 'max_features': 'sqrt', 'bootstrap': True}. Best is trial 183 with value: 0.892159090909091.
[I 2025-04-30 14:07:34,083] Trial 235 finished with value: 0.8906818181818181 and parameters: {'n_estimators': 478, 'max_depth': 47, 'min_samples_split': 6, 'min_samples_leaf': 1, 'max_features': 'sqrt', 'bootstrap': True}. Best is trial 183 with value: 0.892159090909091.
[I 2025-04-30 14:07:45,376] Trial 236 finished with value: 0.8911363636363637 and parameters: {'n_estimators': 502, 'max_depth': 48, 'min_samples_split': 6, 'min_samples_leaf': 1, 'max_features': 'sqrt', 'bootstrap': True}. Best is trial 183 with value: 0.892159090909091.
[I 2025-04-30 14:07:57,257] Trial 237 finished with value: 0.8917045454545456 and parameters: {'n_estimators': 527, 'max_depth': 50, 'min_samples_split': 6, 'min_samples_leaf': 1, 'max_features': 'sqrt', 'bootstrap': True}. Best is trial 183 with value: 0.892159090909091.
[I 2025-04-30 14:08:09,628] Trial 238 finished with value: 0.89125 and parameters: {'n_estimators': 544, 'max_depth': 46, 'min_samples_split': 6, 'min_samples_leaf': 1, 'max_features': 'sqrt', 'bootstrap': True}. Best is trial 183 with value: 0.892159090909091.
[I 2025-04-30 14:08:20,950] Trial 239 finished with value: 0.89125 and parameters: {'n_estimators': 508, 'max_depth': 48, 'min_samples_split': 6, 'min_samples_leaf': 1, 'max_features': 'sqrt', 'bootstrap': True}. Best is trial 183 with value: 0.892159090909091.
